{
  "_id": "2026-09-24-zoho-next-european-study-destinations",
  "tenantId": "toc",
  "sourceId": "2026-09-24-zoho-next-european-study-destinations-src",
  "title": "The Next European Study Destinations to Watch: New Choices for Your Europe Portfolio",
  "date": "2026-09-24",
  "org": "International Business School (IBS) · Hellenic American University (HAU)",
  "status": {
    "transcribe": "done",
    "diarize": "done",
    "summarize": "done",
    "index": "pending"
  }
}
