{
  "_id": "2026-09-21-uniaccess-japan",
  "tenantId": "toc",
  "sourceId": "2026-09-21-uniaccess-japan-src",
  "title": "UniAccess: Japan",
  "date": "2026-09-21",
  "org": "The Outreach Collective (TOC)",
  "status": {
    "transcribe": "pending",
    "diarize": "pending",
    "summarize": "pending",
    "index": "pending"
  }
}
